sequence,0,score
0,from the the the of of to is as in that it we with not you have milk chocolate candy peppermint eggnog gingerbread cookie fruitcake nutcracker snowglobe stocking decorations holly mistletoe poinsettia carol merry jingle drive walk jump sing laugh eat sleep bake relax visit family give gifts unwrap wrapping paper bow toy doll game puzzle card greeting ornament ornament advent candle wreath angel star magi peace joy wish hope believe wonder dream night night scrooge grinch elf reindeer sleigh polar kaggle beard workshop workshop naughty nice chimney chimney fireplace fireplace yuletide holiday season cheer cheer hohoho and and and,34.77254452624438
1,from the the the of of and and and to as in is you that it we have not with eggnog fruitcake yuletide holly wreath mistletoe poinsettia snowglobe stocking advent candle joy peace wonder hope wish dream believe angel star magi sleigh reindeer workshop workshop chimney chimney fireplace fireplace night night holiday season cheer cheer merry jingle elf naughty nice polar beard hohoho laugh sing walk jump eat sleep drive relax visit family give gifts unwrap wrapping paper bow toy doll game puzzle card greeting bake cookie gingerbread candy peppermint chocolate milk nutcracker ornament ornament decorations scrooge grinch carol kaggle,36.72712654703974
2,from the the the of of and and and to is as in that it we with not you have scrooge grinch fruitcake nutcracker reindeer snowglobe holly mistletoe poinsettia advent candle wreath angel star magi peace joy wonder hope wish dream believe carol sing jingle sleigh drive walk jump visit bake cookie candy peppermint chocolate milk eggnog gingerbread elf polar beard workshop workshop naughty nice chimney chimney fireplace fireplace stocking ornament ornament decorations gifts give toy doll puzzle game night night family eat sleep relax unwrap wrapping paper bow card greeting merry yuletide holiday season cheer cheer hohoho laugh kaggle,35.94648303373688
3,from the the the of of to is as in that it we with not you have eggnog fruitcake nutcracker snowglobe holly mistletoe poinsettia carol advent candle wreath angel star magi reindeer elf workshop workshop polar night night beard laugh hohoho jingle sleigh drive walk jump sing eat sleep dream visit family relax unwrap give bake scrooge grinch naughty nice wish wonder believe hope joy peace merry yuletide holiday season cheer cheer greeting card wrapping paper bow ornament ornament decorations gifts toy doll game puzzle candy peppermint chocolate gingerbread cookie milk stocking chimney chimney fireplace fireplace kaggle and and and,34.908640417532865
4,the the the of of to is as in that it we with have not you from eggnog fruitcake nutcracker snowglobe poinsettia holly mistletoe carol jingle yuletide holiday merry peace joy season eat sleep drive walk jump sing laugh wish hope believe wonder dream visit family relax bake cookie gingerbread milk chocolate candy peppermint ornament ornament decorations gifts give wrapping unwrap paper bow toy doll game puzzle card greeting advent wreath candle angel star magi scrooge grinch elf reindeer sleigh kaggle polar beard workshop workshop naughty nice night night stocking chimney chimney fireplace fireplace cheer cheer hohoho and and and,36.87087245606033
5,from the the the of of and and and with as in is you that it we to have not eggnog fruitcake nutcracker snowglobe mistletoe poinsettia holly wreath advent candle star angel magi scrooge grinch carol sing jingle sleigh drive walk wonder wish dream believe hope joy peace candy peppermint chocolate milk cookie bake gingerbread elf reindeer polar beard workshop workshop visit night night naughty nice gifts give family eat sleep relax unwrap wrapping paper bow toy doll game puzzle jump laugh cheer cheer hohoho merry yuletide holiday season greeting card decorations ornament ornament stocking chimney chimney fireplace fireplace kaggle,36.87087245606033
6,from the the the of of and and and have in as is you that it we to not with eggnog fruitcake nutcracker snowglobe holly mistletoe poinsettia carol advent candle wreath star angel magi scrooge grinch sleigh reindeer polar beard elf workshop workshop naughty nice chimney chimney stocking fireplace fireplace night night wish dream believe wonder hope joy peace merry yuletide holiday season cheer cheer hohoho laugh sing jump jingle bake walk drive eat sleep visit family relax unwrap gifts give greeting card candy peppermint chocolate milk gingerbread cookie toy doll game puzzle ornament ornament decorations wrapping paper bow kaggle,37.5980852538711
7,from the the the of of and and and with as in is you that it we to have not eggnog milk chocolate candy peppermint cookie fruitcake gingerbread nutcracker snowglobe stocking decorations ornament ornament holly mistletoe poinsettia carol jingle sleigh drive walk jump sing laugh eat sleep bake relax visit family give gifts unwrap wrapping paper bow toy doll game puzzle card greeting naughty nice wish hope dream believe wonder joy peace cheer cheer merry yuletide holiday season hohoho advent candle wreath angel star magi scrooge grinch reindeer polar beard elf workshop workshop chimney chimney night night fireplace fireplace kaggle,35.25121511458854
